{
  "$schema": "./schema.json",
  "manifestSchemaVersion": 1,
  "specVersion": 1,
  "processorRevision": "sharp-webp-v1",
  "output": {
    "format": "webp",
    "mimeType": "image/webp",
    "withoutEnlargement": true,
    "metadata": "strip",
    "colorSpace": "srgb",
    "dimensionRounding": "half-up"
  },
  "purposes": {
    "PROFILE": ["PROFILE_AVATAR"],
    "REVIEW": ["REVIEW_PREVIEW", "REVIEW_DETAIL"],
    "RESTAURANT": ["RESTAURANT_THUMBNAIL", "RESTAURANT_CARD", "RESTAURANT_HERO"],
    "RESTAURANT_MENU": ["MENU_LIST", "MENU_DETAIL"],
    "MAGAZINE_BANNER": ["MAGAZINE_BANNER"],
    "MAGAZINE_THUMBNAIL": ["MAGAZINE_THUMBNAIL"]
  },
  "roles": {
    "PROFILE_AVATAR": {
      "aspectRatio": {"width": 1, "height": 1},
      "fit": "cover",
      "position": "centre",
      "quality": 78,
      "defaultWidth": 96,
      "candidates": [
        {"width": 48, "height": 48},
        {"width": 96, "height": 96},
        {"width": 192, "height": 192},
        {"width": 288, "height": 288}
      ],
      "noUpscaleFallback": {"selection": "largest-croppable-width", "minimumWidth": 1}
    },
    "RESTAURANT_THUMBNAIL": {
      "aspectRatio": {"width": 1, "height": 1},
      "fit": "cover",
      "position": "centre",
      "quality": 78,
      "defaultWidth": 192,
      "candidates": [
        {"width": 96, "height": 96},
        {"width": 192, "height": 192},
        {"width": 288, "height": 288}
      ],
      "noUpscaleFallback": {"selection": "largest-croppable-width", "minimumWidth": 1}
    },
    "RESTAURANT_CARD": {
      "aspectRatio": {"width": 1, "height": 1},
      "fit": "cover",
      "position": "centre",
      "quality": 78,
      "defaultWidth": 270,
      "candidates": [
        {"width": 135, "height": 135},
        {"width": 270, "height": 270},
        {"width": 405, "height": 405}
      ],
      "noUpscaleFallback": {"selection": "largest-croppable-width", "minimumWidth": 1}
    },
    "RESTAURANT_HERO": {
      "aspectRatio": {"width": 393, "height": 234},
      "fit": "cover",
      "position": "centre",
      "quality": 82,
      "defaultWidth": 860,
      "candidates": [
        {"width": 430, "height": 256},
        {"width": 860, "height": 512},
        {"width": 1290, "height": 769}
      ],
      "noUpscaleFallback": {"selection": "largest-croppable-width", "minimumWidth": 1}
    },
    "MENU_LIST": {
      "aspectRatio": {"width": 1, "height": 1},
      "fit": "cover",
      "position": "centre",
      "quality": 78,
      "defaultWidth": 200,
      "candidates": [
        {"width": 100, "height": 100},
        {"width": 200, "height": 200},
        {"width": 300, "height": 300}
      ],
      "noUpscaleFallback": {"selection": "largest-croppable-width", "minimumWidth": 1}
    },
    "MENU_DETAIL": {
      "aspectRatio": {"width": 393, "height": 234},
      "fit": "cover",
      "position": "centre",
      "quality": 82,
      "defaultWidth": 860,
      "candidates": [
        {"width": 430, "height": 256},
        {"width": 860, "height": 512},
        {"width": 1290, "height": 769}
      ],
      "noUpscaleFallback": {"selection": "largest-croppable-width", "minimumWidth": 1}
    },
    "REVIEW_PREVIEW": {
      "aspectRatio": {"width": 1, "height": 1},
      "fit": "cover",
      "position": "centre",
      "quality": 78,
      "defaultWidth": 270,
      "candidates": [
        {"width": 135, "height": 135},
        {"width": 270, "height": 270},
        {"width": 405, "height": 405}
      ],
      "noUpscaleFallback": {"selection": "largest-croppable-width", "minimumWidth": 1}
    },
    "REVIEW_DETAIL": {
      "aspectRatio": {"width": 393, "height": 574},
      "fit": "cover",
      "position": "centre",
      "quality": 82,
      "defaultWidth": 860,
      "candidates": [
        {"width": 430, "height": 628},
        {"width": 860, "height": 1256},
        {"width": 1290, "height": 1885}
      ],
      "noUpscaleFallback": {"selection": "largest-croppable-width", "minimumWidth": 1}
    },
    "MAGAZINE_BANNER": {
      "aspectRatio": {"width": 353, "height": 160},
      "fit": "cover",
      "position": "centre",
      "quality": 82,
      "defaultWidth": 780,
      "candidates": [
        {"width": 390, "height": 177},
        {"width": 780, "height": 354},
        {"width": 1170, "height": 530}
      ],
      "noUpscaleFallback": {"selection": "largest-croppable-width", "minimumWidth": 1}
    },
    "MAGAZINE_THUMBNAIL": {
      "aspectRatio": {"width": 156, "height": 88},
      "fit": "cover",
      "position": "centre",
      "quality": 78,
      "defaultWidth": 312,
      "candidates": [
        {"width": 156, "height": 88},
        {"width": 312, "height": 176},
        {"width": 468, "height": 264}
      ],
      "noUpscaleFallback": {"selection": "largest-croppable-width", "minimumWidth": 1}
    }
  }
}
